{
  "schema_version": 1,
  "ticket": "TICKET-RELEASE-COMPLETE-20260826-40B1-SECRET-SYNC-ENV",
  "phase": "implementation",
  "scope_rank": 1,
  "complexity_rank": 2,
  "risk_rank": 3,
  "ambiguity_rank": 1,
  "evidence_burden_rank": 3,
  "quota_band": "healthy",
  "work_mode": "mutation",
  "selected_alias": "codex1",
  "selected_model": "gpt-5.6-sol",
  "selected_effort": "high",
  "rationale": "After this BSA handoff, modify only scripts/sync_doppler_secrets.py and .env.example. Remove retired Azure/Fly credential requirements without retrieving, displaying, logging, or mutating secret values. Do not edit trigger inventory, workflows, tests, publisher, generated files, or external systems. Freeze source evidence for ticket40B1 QA.",
  "policy_version": "2026-08-26.1",
  "planning_to_medium_confirmed": true,
  "hitl_approved": true
}
