{
  "schema_version": 1,
  "ticket": "TICKET-RELEASE-COMPLETE-20260826-44R2-PRE-SOURCE-INTEGRATION-QA",
  "phase": "qa",
  "scope_rank": 2,
  "complexity_rank": 2,
  "risk_rank": 2,
  "ambiguity_rank": 1,
  "evidence_burden_rank": 3,
  "quota_band": "healthy",
  "work_mode": "read_only",
  "selected_alias": "codex1",
  "selected_model": "gpt-5.6-sol",
  "selected_effort": "high",
  "rationale": "Supersede only ticket44 attempt-1's stale governance-test path while preserving its immutable blocked evidence and unchanged inventory digest. Run the same documented offline pre-source integration matrix, with command 3 corrected to tests/test_hf_release_governance.py, under the approved codex1_gateway_review sandbox=read-only runtime role. Retain only concise command, exit, and summary evidence. Do not edit files, stage, commit, push, deploy, publish, access credentials or secrets, call the network, retain raw streams, retry, substitute an alias, or infer final metadata/package/release approval.",
  "policy_version": "2026-08-26.1",
  "planning_to_medium_confirmed": true,
  "hitl_approved": true
}
