{
  "schema_version": 1,
  "ticket": "TICKET-RELEASE-COMPLETE-20260826-29-PRODUCTION-MONITOR-FIX",
  "phase": "implementation",
  "scope_rank": 1,
  "complexity_rank": 2,
  "risk_rank": 3,
  "ambiguity_rank": 1,
  "evidence_burden_rank": 3,
  "quota_band": "healthy",
  "work_mode": "mutation",
  "selected_alias": "codex1",
  "selected_model": "gpt-5.6-sol",
  "selected_effort": "high",
  "rationale": "Correct only .github/workflows/production_monitor.yml after its exclusive source ticket starts. Use the canonical HF Docker backend and separately recorded Vercel UI verification, removing Azure fallback without deployment or network invocation. Do not edit other workflows, tests, source, rules, skills, publisher, router, data, generated files, credentials, or external systems. Freeze source evidence for ticket 33 before release QA.",
  "policy_version": "2026-08-26.1",
  "planning_to_medium_confirmed": true,
  "hitl_approved": true
}
