{
  "schema_version": 1,
  "ticket": "TICKET-ALIAS-RC2-003-CODEX1",
  "phase": "operations",
  "scope_rank": 1,
  "complexity_rank": 1,
  "risk_rank": 1,
  "ambiguity_rank": 1,
  "evidence_burden_rank": 2,
  "quota_band": "unknown",
  "work_mode": "read_only",
  "selected_alias": "codex1",
  "selected_model": "gpt-5.6-sol",
  "selected_effort": "high",
  "rationale": "Bounded read-only Vercel gateway and CORS evidence review; evidence integrity sets floor 2 and the selected profile exceeds it.",
  "policy_version": "2026-08-25.2",
  "planning_to_medium_confirmed": true,
  "hitl_approved": true
}
