{
  "schema_version": 1,
  "ticket": "TICKET-PRIORITY-003",
  "phase": "qa",
  "scope_rank": 2,
  "complexity_rank": 2,
  "risk_rank": 2,
  "ambiguity_rank": 1,
  "evidence_burden_rank": 2,
  "quota_band": "healthy",
  "work_mode": "mutation",
  "selected_alias": "codex1",
  "selected_model": "gpt-5.6-terra",
  "selected_effort": "high",
  "rationale": "Work Effort M is the ticket delivery-size and scheduling input. Reasoning effort high is the separate runtime-quality setting selected for independent QA and cannot change scheduling order. The QA lane is reserved after Rule 11 recomputation; quota, planning-to-medium, and HITL gates are confirmed.",
  "policy_version": "2026-08-25.2",
  "planning_to_medium_confirmed": true,
  "hitl_approved": true
}
