{
  "schema_version": 1,
  "ticket": "TICKET-AGY1-SMOKE-20260826-R2",
  "phase": "implementation",
  "scope_rank": 2,
  "complexity_rank": 3,
  "risk_rank": 3,
  "ambiguity_rank": 2,
  "evidence_burden_rank": 3,
  "quota_band": "healthy",
  "work_mode": "mutation",
  "selected_alias": "codex1",
  "selected_model": "gpt-5.6-sol",
  "selected_effort": "high",
  "rationale": "Session HITL approval is recorded without approver identity for this bounded AGY native-protocol remediation. Own only scripts/multiagent_prompt_command.py to align outbound native user-event handling and inbound terminal event/result parsing. The initial smoke established no valid receipt, provider-execution proof, or quota proof. Do not retry externally; receipt-schema drift is separate downstream work. No test, hook, configuration, generated-file, deploy, publish, push, credential, secret, account, raw-PII, or broad refactor action is authorized. Formal QA begins only after this source freezes and a fresh decision/snapshot is available for any later external attempt.",
  "policy_version": "2026-08-25.2",
  "planning_to_medium_confirmed": true,
  "hitl_approved": true
}
