{
  "schema_version": 1,
  "ticket": "TICKET-RELEASE-COMPLETE-20260826-37-DISPATCHER-SCHEMA-FIXTURE-QA",
  "phase": "qa",
  "scope_rank": 1,
  "complexity_rank": 1,
  "risk_rank": 2,
  "ambiguity_rank": 1,
  "evidence_burden_rank": 3,
  "quota_band": "healthy",
  "work_mode": "mutation",
  "selected_alias": "codex1",
  "selected_model": "gpt-5.6-sol",
  "selected_effort": "high",
  "rationale": "Update only tests/test_multiagent_receipt_schema.py after three combined dispatcher failures were isolated to its missing account-home fixture. Add temporary mode-0700 isolated CODEX_HOME and AGY_HOME route fields without credential files, preserve frozen dispatcher source, then rerun the receipt-schema and full dispatcher combined coverage. Do not edit other tests, source/config, workflows, rules, skills, publisher, router, data, generated files, credentials, or external systems.",
  "policy_version": "2026-08-26.1",
  "planning_to_medium_confirmed": true,
  "hitl_approved": true
}
